Herren-Bezirksliga 1 (Ostwestfalen-Lippe) [12];Herren-Bezirksliga 2 (Ostwestfalen-Lippe) [12];Herren-Bezirksklasse 1 (Ostwestfalen-Lippe) [12];Herren-Bezirksklasse 2 (Ostwestfalen-Lippe) [12];Herren-Bezirksklasse 3 (Ostwestfalen-Lippe) [12];Damen-Bezirksliga 1 (Ostwestfalen-Lippe) [10];Damen-Bezirksliga 2 (Ostwestfalen-Lippe) [10];Damen-Bezirksliga 3 (Ostwestfalen-Lippe) [10];Jungen 19 Bezirksliga 1 (Ostwestfalen-Lippe) [10];Jungen 19-Bezirksklasse 1 (Ostwestfalen-Lippe) [12];Herren Kreisliga (Bielefeld/Halle) [12];Herren 1. Kreisklasse - Gruppe 1 (Bielefeld/Halle) [10];Herren 1. Kreisklasse - Gruppe 2 (Bielefeld/Halle) [10];Herren 2. Kreisklasse Gruppe 1 (Bielefeld/Halle) [12];Herren 2. Kreisklasse Gruppe 2 (Bielefeld/Halle) [12];Herren 3. Kreisklasse Vorrunde - Gruppe 1 (Bielefeld/Halle) [12];Herren 3. Kreisklasse Vorrunde - Gruppe 2 (Bielefeld/Halle) [12];Damen Kreisliga (Bielefeld/Halle) [10];Jugend 19 Vorrunde - Gruppe 1 (Bielefeld/Halle) [10];Jugend 19 Vorrunde - Gruppe 2 (Bielefeld/Halle) [10];Jugend 15 Kreisliga (Bielefeld/Halle) [10];Jugend 13 Kreisliga (Bielefeld/Halle) [6];Herren-Kreisliga (Herford) [12];Herren- 1. Kreisklasse (Herford) [10];Herren- 2. Kreisklasse (Herford) [12];Herren- 3. Kreisklasse Gr. 1 (Herford) [10];Herren- 3. Kreisklasse Gr. 2 (Herford) [10];Jungen 19 Kreisliga (Herford) [6];Jungen 15 Kreisliga (Herford) [10];Jungen 13 Kreisliga (Herford) [10];Herren-Kreisliga (Hoexter/Warburg) [10];Herren- 1. Kreisklasse (Hoexter/Warburg) [12];Herren- 2. Kreisklasse 1 (Hoexter/Warburg) [10];Herren- 2. Kreisklasse 2 (Hoexter/Warburg) [10];Herren- 3. Kreisklasse 1 (Hoexter/Warburg) [10];Herren- 3. Kreisklasse 2 (Hoexter/Warburg) [10];Herren- 3. Kreisklasse 3 (Hoexter/Warburg) [10];Herren- 3. Kreisklasse 4 (Hoexter/Warburg) [10];Damen-Kreisliga (Hoexter/Warburg) [6];Jungen-Kreisliga (Hoexter/Warburg) [10];Jungen 1. Kreisklasse (Hoexter/Warburg) [6];Jungen 15 Kreisliga (Hoexter/Warburg) [10];Jungen 13 Kreisliga 1 (Hoexter/Warburg) [10];Jungen 13 Kreisliga 2 (Hoexter/Warburg) [10];Herren-Kreisliga (Lippe) [12];Herren- 1. Kreisklasse 1 (Lippe) [12];Herren- 1. Kreisklasse 2 (Lippe) [12];Herren- 2. Kreisklasse Gruppe 1 (Lippe) [12];Herren- 2. Kreisklasse Gruppe 2 (Lippe) [12];Herren- 2. Kreisklasse Gruppe 3 (Lippe) [12];Herren- 3. Kreisklasse 1 (Lippe) [12];Herren- 3. Kreisklasse 2 (Lippe) [12];Herren- 3. Kreisklasse 3 (Lippe) [12];Jungen 19 Kreisliga A (VR) (Lippe) [10];Jungen 19 Kreisliga B (VR) (Lippe) [10];Jungen 15 Kreisliga A (VR) (Lippe) [10];Jungen 15 Kreisliga B (VR) (Lippe) [10];Herren Kreisliga (Minden/Luebbecke) [12];Herren 1.Kreisklasse Staffel 1 (Minden/Luebbecke) [12];Herren 1.Kreisklasse Staffel 2 (Minden/Luebbecke) [12];Herren 2.Kreisklasse Staffel 1 (Minden/Luebbecke) [10];Herren 2.Kreisklasse Staffel 2 (Minden/Luebbecke) [10];Herren 2.Kreisklasse Staffel 3 (Minden/Luebbecke) [10];Herren 2.Kreisklasse Staffel 4 (Minden/Luebbecke) [10];Herren 3.Kreisklasse Staffel1 (Minden/Luebbecke) [10];Herren 3.Kreisklasse Staffel2 (Minden/Luebbecke) [10];Herren 3.Kreisklasse Staffel3 (Minden/Luebbecke) [10];Herren 3.Kreisklasse Staffel4 (Minden/Luebbecke) [10];Herren 4. Kreisklasse (Minden/Luebbecke) [6];Jungen 19 Kreisliga (Minden/Luebbecke) [10];Jungen 19 1. Kreisklasse (Minden/Luebbecke) [10];Jungen 15 Kreisliga (Minden/Luebbecke) [10];Jungen 15 1.Kreisklasse (Minden/Luebbecke) [10];Herren-Kreisliga (Paderborn) [12];Herren - 1. Kreisklasse 1 (Paderborn) [10];Herren - 1. Kreisklasse 2 (Paderborn) [10];Herren - 2. Kreisklasse 1 (Paderborn) [10];Herren - 2. Kreisklasse 2 (Paderborn) [10];Herren - 3. Kreisklasse Gruppe 1 (Paderborn) [14];Herren - 3. Kreisklasse Gruppe 2 (Paderborn) [14];Jungen 19 Kreisliga (Paderborn) [10];Jungen 15 1. Kreisklasse 1 (Paderborn) [10];Jungen 15 1. Kreisklasse 2 (Paderborn) [10];Jungen 15 2. Kreisklasse (Paderborn) [10];Herren-Kreisliga (Wiedenbrueck) [10];Herren- 1. Kreisklasse (Wiedenbrueck) [10];Herren- 2. Kreisklasse 4er (Wiedenbrueck) [12];Herren- 3. Kreisklasse 4er A (Wiedenbrueck) [10];Herren- 3. Kreisklasse 4er B (Wiedenbrueck) [10];Herren- 3. Kreisklasse 4er C (Wiedenbrueck) [10];Jungen 19 Kreisliga (Wiedenbrueck) [10];Jungen 15 Kreisliga (Wiedenbrueck) [10];Jungen 15 1. Kreisklasse (Wiedenbrueck) [10];Jungen 13 Kreisliga (Wiedenbrueck) [10];
DJK Blau-Weiss Avenwedde III [10];TTSG Rietberg-Neuenkirchen e.V. I [4];TTSG Loehne I [1];DJK Blau-Weiss Avenwedde V [4];TSV Eintracht Belle I [2];VfB Fichte Bielefeld I [3];TV Geseke I [10];DJK Adler Brakel I [1];TuRa Elsen I [10];TuS Bad Driburg I [4];TV Werther I [2];TSVE 1890 Bielefeld III [5];Spvg Steinhagen II [5];VfL Theesen II [6];Spvg Steinhagen III [11];VfL Theesen III [12];VfL Oldentrup II [7];SC GW Varensell I [1];VfB Fichte Bielefeld I [9];Spvg Steinhagen I [5];TSVE 1890 Bielefeld I [6];TSVE 1890 Bielefeld I [4];TTC Roedinghausen II [5];TV Elverdissen I [3];TV Westfalia Buende III [10];SC Herford IV [3];CVJM Wehrendorf IV [7];TV Westfalia Buende I [4];Tischtennisclub Enger I [9];Tischtennisclub Enger I [4];TTV Warburg I [8];Tischtennisverein Hoexter II [1];DJK Adler Brakel III [1];TTV Borgholz II [5];TTC 68 Eichholz I [1];SSV Blau-Weiss Blankenau II [4];SV Teutonia Ossendorf II [10];VfB Koerbecke II [1];TTC Oeynhausen I [1];SV Teutonia Ossendorf I [8];SV Teutonia Ossendorf II [2];SV Menne I [6];Tischtennisverein Hoexter I [6];TTG Ikenhausen I [5];TTS Detmold e.V. II [5];VfL Lueerdissen I [3];TSV Elbrinxen 09 I [5];TTC Retzen I [10];PSG Bad Salzuflen II [3];TTS Detmold e.V. III [1];RSV Hoerste I [2];VfL Lueerdissen III [3];SuS Pivitsheide I [1];VfL Hiddesen-Pivitsheide II [7];TTS Detmold e.V. I [1];TuS Bexterhagen I [6];TTV Lage e.V. I [3];SV Huellhorst-Oberbauerschaft I [3];TuS Lohe I [3];TuS Wehe I [4];TTC Petershagen/Friedewalde e.V. VI [2];TSV Rothenuffeln III [2];TSG Rehme I [7];Spielvereinigung Union Varl I [8];RSV Westfalia Mindenerwald I [1];TSG Rehme III [7];Holsener SV von 1964 e.V. II [2];TTC Rahden III [4];SC Hollwede IV [4];ATSV Espelkamp I [8];SC Blau-Weiss Vehlage I [4];ATSV Espelkamp I [8];TTU Bad Oeynhausen e.V. II [1];TTV Hoevelhof I [3];SC Victoria Neuenbeken I [1];TTC Bad Lippspringe I [2];TTV Salzkotten II [5];VfL Thuele I [9];TV Geseke V [5];SV Rot-Weiss Alfen II [6];TTV Salzkotten I [5];TTV Salzkotten I [1];VfL Thuele I [1];SC Victoria Neuenbeken I [1];TV Isselhorst I [1];TTC Oelde I [2];DJK Guetersloh II [9];TSG Harsewinkel II [2];TTSV Schloss Holte-Sende V [5];DJK Guetersloh IV [2];DJK Guetersloh I [5];TTSV Schloss Holte-Sende I [3];Guetersloher Turnverein von 1879 e.V. I [10];DJK Blau-Weiss Avenwedde I [1];
TTS Detmold e.V. I [7];DJK Adler Brakel I [12];ESV Bielefeld I [4];TTV Salzkotten I [5];TuS Bad Driburg I [1];VfL Frotheim I [7];TuS Bega 09 I [2];TTV Gruen-Weiss Daseburg II [5];Tischtennisclub Enger I [4];TTV Gruen-Weiss Daseburg I [12];TSVE 1890 Bielefeld II [12];SC Babenhausen I [10];SV Brackwede V [3];TuS Hillegossen III [9];TTC Dornberg II [10];Spvg. Heepen V [6];BTG Bielefeld I [4];Spvg Steinhagen I [10];Spvg. Heepen I [5];TSVE 1890 Bielefeld III [6];VfB Fichte Bielefeld I [9];VfL Oldentrup I [1];TV Westfalia Buende I [10];TV Westfalia Buende II [4];TV Elverdissen II [2];TV Elverdissen III [1];VfL Viktoria Mennighueffen II [2];TG Herford I [1];TV Westfalia Buende I [2];Tischtennisclub Enger II [9];SV Voerden I [7];FC Stahle 30 e.V. I [7];Tischtennisverein Hoexter III [6];TTV Warburg II [8];TuS Bad Driburg IV [4];FC Buehne 1929 III [3];SV Menne V [6];TTC Diemeltal e.V. II [2];TTV Gruen-Weiss Daseburg III [6];TTV Gruen-Weiss Daseburg II [5];DJK Adler Brakel II [1];DJK Adler Brakel I [3];TuS Bad Driburg I [3];TTC Borgentreich I [3];TuS Helpup II [7];TVE Valdorf I [8];TTV Lage e.V. III [6];TTC Schuckenbaum I [11];VfL Lueerdissen II [9];TSV Eintracht Belle IV [8];TTV Lage e.V. VII [5];TVE Valdorf III [8];TSV Elbrinxen 09 III [5];TTV Lage e.V. I [2];TuS Bexterhagen III [6];TTV Horn-Bad Meinberg e.V. I [3];TSV Eintracht Belle II [1];Sport Club Blasheim I [7];SV 1860 Minden I [10];SC Blau-Weiss Vehlage I [12];SV Kutenhausen-Todtenhausen I [3];SuS Veltheim III [10];TuS Lohe II [1];ATSV Espelkamp II [7];TTC Petershagen/Friedewalde e.V. VII [7];TSG Rehme IV [2];TSV Rothenuffeln V [3];SuS Holzhausen I [5];SV Boerninghausen IV [3];SuS Veltheim I [10];ATSV Espelkamp II [3];TSV Hahlen I [1];SC Hollwede I [10];SV Heide Paderborn I [4];DJK Graf Spork Delbrueck I [8];TTV Hoevelhof II [3];DJK Graf Spork Delbrueck II [3];TV Geseke III [5];VfL Thuele II [2];TTV Hoevelhof IV [10];SC GW Paderborn I [8];SV Rot-Weiss Alfen I [2];TuS Bad Wuennenberg I [2];TuRa Elsen III [2];TSG Harsewinkel I [2];SC Germania Stromberg I [3];SV Rot-Weiss Mastholte II [1];DJK Guetersloh III [3];TTSG Rietberg-Neuenkirchen e.V. IV [9];TTSV Schloss Holte-Sende VI [10];TV Einigkeit Langenberg II [6];TTSG Rietberg-Neuenkirchen e.V. I [9];TTSG Rietberg-Neuenkirchen e.V. II [4];TTSG Rietberg-Neuenkirchen e.V. I [9];
TTU Bad Oeynhausen e.V. II [1];TuS Bad Wuennenberg I [8];Tischtennisclub Enger II [7];TuS Helpup I [1];SC GW Paderborn I [5];TTC Petershagen/Friedewalde e.V. I [2];TTV Lage e.V. II [9];TTV Borgholz I [4];DJK Blau-Weiss Avenwedde II [6];FC Buehne 1929 I [9];TTG Versmold I [1];TuS Hillegossen II [3];TSVE 1890 Bielefeld IV [10];SC Bielefeld I [1];TTC Altenhagen I [2];TTG Versmold II [1];Spvg. Heepen VI [12];SV Gadderbaum I [8];VfL Theesen I [6];TTG Versmold I [2];TuS Joellenbeck I [1];TSVE 1890 Bielefeld II [6];CVJM Exter I [3];Tischtennisclub Enger V [1];SG 1910 Frisch-Auf Herringhausen-Eickum e.V. I [5];TV Westfalia Buende V [9];TuS Barduettingdorf-Wallenbrueck IV [5];Tischtennisclub Enger II [5];TTC Mennighueffen I [5];TTC Mennighueffen I [5];TTC Borgentreich I [5];TTV Borgholz I [11];TuS Bad Driburg III [4];SV Menne IV [1];Sportverein 1930 Bergheim V [8];FC Stahle 30 e.V. II [1];TTG Ikenhausen IV [2];TTG Ikenhausen V [7];TTG Ikenhausen I [4];Tischtennisverein Hoexter I [6];TTG Ikenhausen I [6];TTV Gruen-Weiss Daseburg I [10];SV Voerden I [7];SV Teutonia Ossendorf II [8];TTSG Erder I [6];TTG Lemgo e.V. III [2];TSV Bentrup-Lossbruch II [3];TTV Lage e.V. V [5];VfL Lieme I [11];TSV Eintracht Belle V [7];TSV Bentrup-Lossbruch IV [3];TTG Lemgo e.V. VI [9];SV Diestelbruch/Mosebeck II [2];TTV Horn-Bad Meinberg e.V. I [3];Sportfreunde Berlebeck-Heiligenkirchen e.V. II [9];TSV Eintracht Belle I [5];VfL Hiddesen-Pivitsheide II [7];Sportverein Leteln-Weser I [4];SuS Veltheim II [12];TTC Rahden II [10];TV Hille II [5];TSV Hahlen V [3];TuS Victoria Dehme e.V. II [8];SC Hollwede III [1];SV 1860 Minden III [4];TTU Bad Oeynhausen e.V. VIII [1];VfL Frotheim I [1];Spielvereinigung Union Varl II [3];SV Huellhorst-Oberbauerschaft VI [1];TTU Bad Oeynhausen e.V. II [1];SC Blau-Weiss Vehlage II [9];TTU Bad Oeynhausen e.V. I [6];TTG Windheim-Neuenknick I [5];TV Geseke II [11];TTC Paderborn e.V. III [4];TuRa Elsen VI [10];VfL Lichtenau I [6];SC GW Paderborn V [4];SV BW Etteln IV [1];TuS Bad Wuennenberg V [2];SV Rot-Weiss Alfen I [1];TuRa Elsen I [3];SC GW Paderborn I [3];SV Rot-Weiss Alfen II [3];TV Einigkeit Langenberg II [7];TSG Rheda I [4];SV Spexard III [11];TV 1912 Verl e.V. III [6];TV Isselhorst III [1];SC Wiedenbrueck e.V. VI [9];TTSG Rietberg-Neuenkirchen e.V. I [4];DJK Blau-Weiss Avenwedde I [1];TTSV Schloss Holte-Sende III [3];SC Germania Stromberg I [3];
CVJM Wehrendorf I [2];Tischtennisverein Hoexter I [7];Spvg. Heepen I [6];TTV Lage e.V. I [11];TuRa Elsen IV [11];TuS Nettelstedt I [4];SV Rot-Weiss Mastholte I [6];DJK Adler Brakel II [2];VfL Hiddesen-Pivitsheide I [2];TSV Eintracht Belle I [2];TuS Quelle I [6];TuS Brake III [9];SV Ubbedissen I [7];VfL Ummeln II [7];ESV Bielefeld III [4];TuS Joellenbeck IV [2];SV Ubbedissen II [2];TTC Oelde I [2];SV Ubbedissen I [3];Telekom Post SV Bielefeld e.V. I [7];Spvg. Heepen I [10];ESV Bielefeld I [3];TuS Barduettingdorf-Wallenbrueck II [12];TTC Mennighueffen IV [6];CVJM Exter II [9];CVJM Wehrendorf V [2];TV Westfalia Buende VI [4];TuS Barduettingdorf-Wallenbrueck I [6];TTC Mennighueffen II [10];CVJM Wehrendorf I [7];SSV Blau-Weiss Blankenau I [1];TuS Bad Driburg II [8];TTC Grevenhagen I [5];TTC Fortuna Frohnhausen I [4];TTC Oeynhausen I [5];Tischtennisverein Hoexter IV [2];SV 23 Drenke e.V. I [4];SV Teutonia Ossendorf III [10];TTV Borgholz III [3];SV Menne I [1];Sportverein 1930 Bergheim I [5];TuS Bad Driburg I [4];TTV Borgholz II [1];TTV Borgholz I [1];TSV Eintracht Belle II [2];TuS Bexterhagen IV [1];TV Blomberg I [11];PSG Bad Salzuflen III [1];TVE Valdorf II [2];SV Diestelbruch/Mosebeck I [4];TuS Helpup V [1];TTC Retzen II [4];TuS Holzhausen/Externsteine I [7];Sportfreunde Berlebeck-Heiligenkirchen e.V. I [4];SV Bavenhausen I [2];TuS Helpup I [2];TuS Bexterhagen II [10];TG Werste I [5];TTC Petershagen/Friedewalde e.V. IV [8];ATSV Espelkamp I [2];TuS Porta Westfalica I [4];TV Hille III [9];TSG Rehme II [2];TuS Wehe II [4];TTC Petershagen/Friedewalde e.V. VIII [6];TuS Victoria Dehme e.V. III [3];TV Hille IV [10];TuS Dielingen III [6];TTV Luebbecke IV [6];TuS Victoria Dehme e.V. I [7];TuS Stemwede I [1];Sport Club Blasheim I [2];TSV Hahlen II [3];TuS Bad Wuennenberg II [2];SV Heide Paderborn II [9];SV Blau-Weiss Benhausen I [9];SC GW Paderborn IV [10];TuS Bad Wuennenberg III [7];SC GW Paderborn VIII [6];TuRa Elsen VIII [12];VfL Thuele I [4];DJK Graf Spork Delbrueck I [10];TuRa Elsen II [4];SV Heide Paderborn I [4];DJK Blau-Weiss Avenwedde VI [4];TTSV Schloss Holte-Sende II [10];SC Wiedenbrueck e.V. IV [4];SV Herzebrock III [1];TSG Harsewinkel III [7];SV Spexard IV [1];SC Wiedenbrueck e.V. I [7];SC Wiedenbrueck e.V. I [4];DJK Blau-Weiss Avenwedde II [6];SV Herzebrock I [7];
TSV Hahlen II [9];TuRa Elsen III [5];VfL Theesen I [5];SV Herzebrock I [2];SV BW Etteln I [7];TTV Luebbecke I [5];TV Geseke II [5];TuS RW Peckelsheim I [9];TTC Mennighueffen I [9];TTSV Schloss Holte-Sende I [3];VfB Fichte Bielefeld I [3];TuS Quelle II [2];VfL Ummeln I [1];TuS Vilsendorf I [8];Spvg. Heepen IV [12];TTC Dornberg III [10];TuS 08 Senne 1 e.V. I [9];BTG Bielefeld I [5];TuS Hillegossen I [8];TSVE 1890 Bielefeld IV [1];TuS Quelle I [2];TV Werther I [2];TG Herford I [7];TG Herford II [10];VfL Viktoria Mennighueffen I [6];TV Lenzinghausen III [8];TuS Gohfeld III [8];TuS Gohfeld I [2];TV Westfalia Buende II [7];CVJM Wehrendorf II [2];TTV Gruen-Weiss Daseburg I [10];Turnverein Riesel I [4];DJK Nieheim I [7];TTV Warburg III [9];DJK Nieheim II [3];Turnverein Riesel II [5];TTV Gruen-Weiss Daseburg II [5];TTV Gruen-Weiss Daseburg III [9];;TTV Warburg I [3];TTV Borgholz II [4];Tischtennisverein Hoexter I [1];TuS Bad Driburg II [4];SV Teutonia Ossendorf I [7];TTG Lemgo e.V. I [3];TuS Helpup III [7];RSV Augustdorf I [1];TSV Bentrup-Lossbruch III [9];TTG Lemgo e.V. IV [8];TSV Elbrinxen 09 II [11];VfL Hiddesen-Pivitsheide II [6];TTSG Erder III [1];VfL Schlangen II [6];TuS Bexterhagen I [6];TTV Lage e.V. II [8];TTV Horn-Bad Meinberg e.V. II [8];TTV Horn-Bad Meinberg e.V. III [2];TTV Luebbecke I [6];TG Werste II [4];SV Boerninghausen I [3];TSV Hahlen VI [7];TuS Porta Barkhausen II [4];Sport Club Blasheim III [6];SC Blau-Weiss Vehlage II [10];Sportverein Leteln-Weser III [2];SuS Veltheim IV [5];SV Huellhorst-Oberbauerschaft V [4];SV Boerninghausen III [2];HSC Alswede von 1946 e.V. II [5];TG Werste I [3];Sportverein Leteln-Weser II [6];TG Werste I [3];TSV Hahlen III [4];SC GW Paderborn II [5];SC GW Paderborn III [10];FC Stukenbrock I [7];TuS Bad Wuennenberg IV [7];SC GW Paderborn VI [6];SC Wewer 2000 II [7];DJK Graf Spork Delbrueck III [3];SV Rot-Weiss Bentfeld I [7];BV 23 Alme e.V. I [4];DJK Graf Spork Delbrueck II [5];SC Borchen I [5];SC Wiedenbrueck e.V. III [9];SV Herzebrock II [7];TTC Oelde II [2];TTC Simonswerk Rheda I [5];Guetersloher Turnverein von 1879 e.V. III [6];Guetersloher Turnverein von 1879 e.V. IV [5];SC Germania Stromberg I [3];TTSV Schloss Holte-Sende II [8];TV Einigkeit Langenberg I [1];TTSV Schloss Holte-Sende I [2];
DJK BW Bielefeld I [11];TTC Paderborn e.V. I [10];TuS Joellenbeck I [2];TTSG Rietberg-Neuenkirchen e.V. II [10];TTG Ikenhausen I [8];TTC Roedinghausen I [8];TTV Horn-Bad Meinberg e.V. I [3];FC Buehne 1929 I [8];TSG Harsewinkel I [5];TTU Bad Oeynhausen e.V. I [7];TTC Dornberg I [4];VfB Fichte Bielefeld II [8];Spvg. Heepen III [4];TuS Joellenbeck III [2];SV Brackwede VII [9];TSVE 1890 Bielefeld VI [7];VfL Ummeln III [10];TSVE 1890 Bielefeld I [6];VfB Fichte Bielefeld II [4];TV Werther I [4];TV Werther I [8];TuS Hillegossen I [5];TuS Gohfeld I [8];TTSG Loehne II [7];CVJM St. Stephan Vlotho I [7];TuS Huecker-Aschen III [6];CVJM Wehrendorf VI [6];;TuS Gohfeld I [3];TTC Mennighueffen II [10];DJK Adler Brakel II [2];SV Voerden II [9];Sportverein 1930 Bergheim IV [3];Westfalia 03 Scherfede-Rimbeck I [2];SV Voerden V [7];DJK Adler Brakel IV [6];SV Menne VI [1];TTC Borgentreich III [5];;DJK Adler Brakel I [2];;TuS Bad Driburg II [7];DJK Adler Brakel I [5];SV Menne I [6];TSV Bentrup-Lossbruch I [4];TTSG Erder II [6];TuS Schieder-Schwalenberg e.V. II [9];TTV Lage e.V. VI [6];TTV BW Silixen II [10];CVJM Detmold II [5];PSG Bad Salzuflen V [7];VfL Lieme II [5];CVJM Detmold III [10];TuS Helpup I [8];SV Diestelbruch/Mosebeck I [3];VfL Hiddesen-Pivitsheide I [1];TTC Schuckenbaum I [9];TSV Hahlen III [9];TuS Victoria Dehme e.V. I [9];TV Hille I [5];Sportverein Leteln-Weser II [8];TuS Holzhausen/Porta II [5];SV Huellhorst-Oberbauerschaft III [3];TuS Stemwede I [3];SV 1860 Minden IV [3];TuS Porta Barkhausen III [6];SV Huellhorst-Oberbauerschaft IV [8];SC Blau-Weiss Vehlage III [10];HSC Alswede von 1946 e.V. III [2];Sportverein Leteln-Weser I [4];TuS Nettelstedt I [7];TTC Petershagen/Friedewalde e.V. I [7];TTV Luebbecke I [6];SC Wewer 2000 I [12];TuRa Elsen VII [5];SV BW Etteln III [6];TV Geseke IV [9];TTC Kolping Boke I [1];SC Borchen I [8];TuS Wewelsburg I [7];SV Heide Paderborn I [2];SV BW Etteln I [5];TSV Schloss Neuhaus I [6];SC Borchen II [6];DJK Guetersloh I [5];TV 1912 Verl e.V. II [1];TV Einigkeit Langenberg III [8];DJK Blau-Weiss Avenwedde VIII [4];TTC Oelde IV [8];TV Isselhorst IV [3];TTSV Schloss Holte-Sende II [8];SV Herzebrock I [2];SV Spexard I [9];TTSV Schloss Holte-Sende II [8];
TuS Bexterhagen II [12];SV Spexard II [6];SC Herford I [9];SC Wiedenbrueck e.V. II [3];TSV Schloss Neuhaus I [6];VfL Oldentrup II [1];TuS Bad Driburg II [1];TuS RW Peckelsheim II [10];CVJM Wehrendorf I [3];TuRa Elsen II [11];TuS Brake II [5];TSVE 1890 Bielefeld V [1];TV Werther II [8];Telekom Post SV Bielefeld e.V. II [5];SC Halle II [1];SC Babenhausen II [5];TTG Versmold III [8];DJK Blau-Weiss Avenwedde II [4];VfL Oldentrup II [1];BTG Bielefeld I [10];Spvg. Heepen II [5];;CVJM Wehrendorf II [2];SC Herford III [8];TuS Huecker-Aschen II [1];TV Westfalia Buende VII [10];Tischtennisclub Enger VII [1];;Tischtennisclub Enger II [4];Tischtennisclub Enger III [8];Sportverein 1930 Bergheim III [9];TTG Ikenhausen II [2];SV Voerden IV [2];TTG Ikenhausen III [7];DJK Nieheim III [9];TTV Borgholz III [10];TTV Warburg IV [3];SV Teutonia Ossendorf IV [4];;TTV Borgholz I [10];;TTG Ikenhausen I [9];SV Voerden II [8];TTC Borgentreich II [9];TuS Bexterhagen III [8];TuS Langenholzhausen I [11];TSV Eintracht Belle III [2];TTS Detmold e.V. IV [2];TuS Brake/Lippe I [4];TTS Detmold e.V. V [6];TuS Ahmsen II [8];VfL Lueerdissen IV [10];TTV Horn-Bad Meinberg e.V. IV [3];TSV Eintracht Belle II [5];TTV Horn-Bad Meinberg e.V. II [7];;TuS Bexterhagen III [6];SC Hollwede I [1];TuS Porta Barkhausen I [5];SV Huellhorst-Oberbauerschaft II [11];TTC Petershagen/Friedewalde e.V. V [1];TSV Rothenuffeln IV [6];TG Werste III [4];TuS Wehe III [9];SV Kutenhausen-Todtenhausen III [5];TG Werste V [8];Sport Club Blasheim V [6];TuS Dielingen II [7];;SV Boerninghausen I [6];SV Boerninghausen II [2];Sportverein Leteln-Weser I [4];Spielvereinigung Union Varl I [7];SV BW Sande I [9];SC BW Ostenland I [3];ESV TuS Altenbeken I [1];TTV Hoevelhof III [8];BV 23 Alme e.V. I [2];FC Stukenbrock II [9];SV Heide Paderborn V [4];TuRa Elsen III [6];;;BV 23 Alme e.V. II [7];SW Marienfeld I [6];DJK Blau-Weiss Avenwedde VII [9];TTSV Schloss Holte-Sende III [5];SV Rot-Weiss Mastholte III [8];SC Wiedenbrueck e.V. V [4];TTC Simonswerk Rheda II [4];TV 1912 Verl e.V. I [9];SC Germania Stromberg I [7];TTSV Schloss Holte-Sende IV [8];DJK Guetersloh I [4];
Spvg Steinhagen I [5];DJK Blau-Weiss Avenwedde IV [11];SC Halle I [12];TV 1912 Verl e.V. I [8];Sportverein 1930 Bergheim II [9];SC Hollwede I [6];TTV Hoevelhof II [8];TTV Borgholz II [6];TSVE 1890 Bielefeld II [1];VfL Oldentrup I [6];TuS Hillegossen I [9];SV Brackwede VI [7];DJK BW Bielefeld II [2];SV Brackwede VIII [3];TuS Brake IV [3];CVJM Heepen I [3];TuS Hillegossen IV [3];TTC Schuckenbaum I [3];;SV Gadderbaum I [3];;;Tischtennisclub Enger IV [6];TTC Roedinghausen III [2];CVJM Wehrendorf III [8];TG Herford III [5];TV Lenzinghausen IV [3];;CVJM Wehrendorf I [8];TTC Mennighueffen III [1];SV Menne III [6];VfB Koerbecke I [6];;TTC Fortuna Frohnhausen II [10];DJK Nieheim IV [2];SV Boekendorf I [7];Turnverein Riesel III [7];SV Menne VII [6];;;;TTC Fortuna Frohnhausen I [5];SV Voerden III [2];TTV Gruen-Weiss Daseburg I [4];TTV Lage e.V. II [11];TuS Bega 09 II [9];TV Barntrup I [7];TuS Helpup IV [7];PSG Bad Salzuflen IV [5];TTV Horn-Bad Meinberg e.V. II [3];TTC Schuckenbaum III [10];TTG Lemgo e.V. VII [2];Sportfreunde Oesterholz-Kohlstaedt e.V. I [11];TuS Bexterhagen II [1];TTV BW Silixen I [10];;;SuS Veltheim I [12];TuS Holzhausen/Porta I [11];Holsener SV von 1964 e.V. I [8];SV 1860 Minden II [9];TuS Holzhausen/Porta III [1];TTU Bad Oeynhausen e.V. VII [5];SV Boerninghausen II [6];TTG Windheim-Neuenknick IV [8];TTU Bad Oeynhausen e.V. X [10];TTU Bad Oeynhausen e.V. IX [7];ATSV Espelkamp III [1];;TTC Petershagen/Friedewalde e.V. I [2];TSV Hahlen III [8];SV Huellhorst-Oberbauerschaft I [5];TTC Petershagen/Friedewalde e.V. II [2];SV BW Etteln II [7];SV Rot-Weiss Bentfeld II [7];SV Heide Paderborn III [4];SV Rot-Weiss Bentfeld III [2];SC BW Ostenland II [8];VfL Lichtenau II [11];TTV Salzkotten III [8];DJK Graf Spork Delbrueck I [3];;;;TSV Victoria Clarholz I [10];TV Isselhorst II [5];Guetersloher Turnverein von 1879 e.V. II [10];TSG Rheda II [9];TSV Victoria Clarholz IV [10];SV Herzebrock IV [7];Post SV Guetersloh I [1];Post SV Guetersloh I [6];TSV Victoria Clarholz I [2];;
TSVE 1890 Bielefeld I [6];TV Einigkeit Langenberg I [2];TuS Huecker-Aschen I [3];TTSV Schloss Holte-Sende I [6];TuS Schieder-Schwalenberg e.V. I [3];;;;TSV Hahlen II [7];CVJM Wehrendorf II [8];ESV Bielefeld II [10];TuS Eintracht Bielefeld I [4];Telekom Post SV Bielefeld e.V. I [6];ESV Bielefeld IV [10];TuS Quelle III [5];TuS Hillegossen V [9];Spvg Steinhagen IV [5];;;;;;TV Lenzinghausen I [9];TuS Barduettingdorf-Wallenbrueck III [5];TuS Gohfeld II [11];;;;TG Herford I [6];TTC Mennighueffen IV [3];;TTC Diemeltal e.V. I [10];;;TTC Oeynhausen II [6];Turnverein Riesel IV [9];TTV Borgholz IV [9];FC Buehne 1929 IV [8];;;;TTC Borgentreich I [8];;TTV Borgholz III [10];VfL Hiddesen-Pivitsheide I [9];TTV BW Silixen I [10];CVJM Detmold I [12];TuS Ahmsen I [12];TuS Langenholzhausen II [1];TuS Schieder-Schwalenberg e.V. III [2];TuS Bexterhagen VI [12];TuS Vossheide I [6];TSV Eintracht Belle VI [8];;;;;TTU Bad Oeynhausen e.V. IV [2];TTU Bad Oeynhausen e.V. V [7];TSV Rothenuffeln II [9];TV Jahn 1892 Neesen II [6];SV Kutenhausen-Todtenhausen II [7];TG Werste IV [9];Sport Club Blasheim IV [2];Sportverein Leteln-Weser IV [9];TuS Holzhausen/Porta IV [4];TV Hille V [5];HSC Alswede von 1946 e.V. I [8];;SV Huellhorst-Oberbauerschaft I [5];SuS Veltheim II [5];;;SV Rot-Weiss Bentfeld I [1];;;SV BW Sande II [4];SV Heide Paderborn IV [10];TTC Bad Lippspringe II [12];BV 23 Alme e.V. II [9];SC Victoria Neuenbeken I [9];;;;TTSG Rietberg-Neuenkirchen e.V. III [3];;Post SV Guetersloh II [3];TTC Oelde III [7];TTSG Rietberg-Neuenkirchen e.V. V [3];;DJK Blau-Weiss Avenwedde III [10];SV Rot-Weiss Mastholte I [5];SW Marienfeld I [5];;
SV Brackwede III [3];SC Wiedenbrueck e.V. I [3];TTG Windheim-Neuenknick I [11];Guetersloher Turnverein von 1879 e.V. I [12];TTC Paderborn e.V. II [10];;;;;TuS Joellenbeck I [5];VfL Oldentrup I [7];;;SF Sennestadt I [11];VfB Fichte Bielefeld III [8];Telekom Post SV Bielefeld e.V. III [11];SC Halle III [6];;;;;;TTC Mennighueffen III [11];;Tischtennisclub Enger VI [12];;;;TuS Barduettingdorf-Wallenbrueck I [1];;;TuS RW Peckelsheim I [5];;;;;;;;;;SV Voerden I [2];;TTV Borgholz IV [2];PSG Bad Salzuflen I [12];SV Bavenhausen III [5];RSV Augustdorf II [8];TTG Lemgo e.V. V [3];SV Bavenhausen IV [12];VfL Schlangen I [12];TTC Schuckenbaum IV [4];TuS Langenholzhausen III [7];TTV Horn-Bad Meinberg e.V. V [9];;;;;TTC Petershagen/Friedewalde e.V. III [8];TV Jahn 1892 Neesen I [1];TTV Luebbecke II [6];TTG Windheim-Neuenknick III [10];TuS Nettelstedt I [8];TTV Luebbecke III [10];TuS Dielingen I [5];;;;TuS Stemwede II [9];;;;;;TuRa Elsen V [6];;;SC GW Paderborn VII [1];;SC Victoria Neuenbeken II [13];SV Heide Paderborn VI [11];ESV TuS Altenbeken I [10];;;;Post SV Guetersloh I [8];;TSV Victoria Clarholz II [6];;;;TSV Victoria Clarholz I [2];;SV Rot-Weiss Mastholte II [7];;
SV Bavenhausen I [4];Sportverein 1930 Bergheim I [9];TTU Bad Oeynhausen e.V. III [8];SV Rot-Weiss Mastholte I [7];FC Buehne 1929 II [4];;;;;TTC Mennighueffen II [1];TuS Joellenbeck II [8];;;VfB Fichte Bielefeld IV [4];TV Werther III [6];SC Bielefeld II [4];Telekom Post SV Bielefeld e.V. IV [11];;;;;;Tischtennisclub Enger III [1];;TV Lenzinghausen II [4];;;;;;;TTC Borgentreich II [12];;;;;;;;;;;;;SV Bavenhausen II [10];TTV Lage e.V. IV [12];Sportfreunde Berlebeck-Heiligenkirchen e.V. I [4];TuS Bexterhagen V [8];TV Barntrup II [7];TTV Horn-Bad Meinberg e.V. III [9];TSV Bentrup-Lossbruch V [9];;Sportfreunde Berlebeck-Heiligenkirchen e.V. III [4];;;;;TSV Rothenuffeln I [10];TTU Bad Oeynhausen e.V. VI [2];SC Hollwede II [7];;;;;;;;;;;;;;SV Rot-Weiss Alfen I [10];;;;;TTV Hoevelhof V [3];TSV Schloss Neuhaus III [1];;;;;;;TTSV Schloss Holte-Sende IV [12];;;;;;;;
